"source_file","project_id","project_title","project_leads","collaborators","location","salmon_species","waterbodies","stock","population","conservation_unit","code_software","field_work","highlights","background","methods_findings","insights","next_steps"
"PSSI Science Project Reporting- salmonMSE.docx","2449","A decision-suppor ool ha considers harves , ha chery, and habi a managemen levers o suppor implemen a ion of he Fisheries Ac for Pacific salmon",,,"Click or ap here o en er ex .","Chinook","Applicable o all species; case s udy on Chinook salmon

Click or ap here o en er ex .",,,"Applicable across popula ions and s ocks; case s udy on Sari a River Chinook wi hin Wes Vancouver Island-Sou h Chinook CU","salmonMSE R package: Huynh Q (2025). salmonMSE: Managemen S ra egy Evalua ion for Salmon. R package version 0.1.1. h ps://cran.rs udio.com/web/packages/salmonMSE/index.h ml

salmonMSE code Reposi ory: h ps://gi hub.com/Blue-Ma er/salmonMSE

Applica ion of salmonMSE o Wes coas Vancouver Island, Sari a River Chinook- Code reposi ory: h ps://gi hub.com/Blue-Ma er/WCVI_Chinook

Applica ion of salmonMSE o Upper S rai of Georgia Chinook- Code Reposi ory: h ps://gi hub.com/Pacific-salmon-assess/UpperSoG_Chinook","NA","Unders anding he performance of managemen ac ions prior o implemen a ion is increasingly cri ical for Pacific salmon given accoun abili ies under he modernized Fisheries Ac and growing risks associa ed wi h environmen al and biological variabili y and change, ye ools o evalua e harves , ha chery and habi a levers have no been available.

We developed an open-source, decision-suppor ool, salmonMSE, o priori ize managemen ac ions rela ed o harves regula ion, ha chery enhancemen and habi a res ora ion o achieve objec ives across sec ors. 

This ool expands on hose previously used by explici ly accoun ing for dynamics of ha chery-origin and na ural-origin fish, modelling mark-selec ive fisheries, considering risk and uncer ain y, and including biological realism wi h he abili y o model a diversi y of life-his ory s ra egies.","Pacific salmon are exposed o numerous in erac ing s ressors, including clima e change, fishing, and land-use changes rela ed o e.g., urban developmen , fores ry, mining, and agricul ure (Tulloch e al. 2022). Managemen of salmon is mul iface ed o address hese s ressors: including harves regula ion, ha chery enhancemen and habi a res ora ion. 

Managemen decisions increasingly require ransparency and risk-based approaches o respond o uncer ain ies. For example, he Fisheries Ac requires he developmen of rebuilding plans for s ocks ha fall below limi reference poin s (considered in a ‘cri ical’ s a us zone). There is an emerging need o evalua e performance of candida e managemen ac ions for rebuilding plans prior o implemen a ion, and he DFO’s precau ionary approach framework requires uncer ain y and risk o be aken in o accoun when developing and implemen ing decision rules.

Similarly, under he Species a Risk Ac , here is a need o evalua e recovery po en ial of popula ions a risk of ex inc ion under various managemen scenarios. However, we lack accessible, broadly applicable quan i a ive ools o evalua e managemen op ions across managemen levers. 

Through his projec we developed an open-source, decision-suppor ool for Pacific salmon, salmonMSE, o inform science advice for In egra ed Managemen Plans, Rebuilding Plans under he Fisheries Ac , Salmon Enhancemen Plans, and he SARA lis ing process. 

This ool can address ques ions like: 

Wha level of ha chery enhancemen and harves regula ion are required o achieve rebuilding arge s? 

Wha is he maximum ha chery produc ion possible while main aining ‘wild’ popula ion s a us, as defined by propor iona e na ural influence, PNI goals by Wi her e al. (2018)? 

How should mass-marking s ra egies and mark-selec ive fisheries be designed in order o achieve harves and PNI goals while allowing for conserva ion of wild popula ions?

Wi hin ha cheries, which harves release s ra egies and brood ake rules bes mee conserva ion and PNI objec ives?

Where rela ionships be ween environmen al drivers or limi ing fac ors and survival ra es have been iden ified, wha are he benefi s of habi a res ora ion o mi iga e impac s of hose fac ors on conserva ion and harves objec ives, rela ive o o her managemen levers? 

In par nership wi h Huu-ay-ah Firs Na ion, DFO Salmon Enhancemen Program and DFO Science, we applied salmonMSE o Sari a River Chinook, on he wes coas of Vancouver Island as a case s udy, o evalua e he impac s of mark-selec ive fisheries and ha chery scenarios on he abili y o achieve a range of conserva ion, harves and ha chery objec ives, and o inform rebuilding plans.","SalmonMSE is a decision-suppor ool developed for Pacific salmon founded on ‘managemen s ra egy evalua ion’, MSE, which is an approach for evalua ing he rela ive effec iveness of managemen ac ions using compu er simula ions ha represen various possible reali ies of he fishery and he biological sys ems (Pun e al. 2016; openMSE 2023). To accoun for uncer ain ies, hese simula ions are repea ed over numerous possible reali ies o produce a dis ribu ion of ou comes for each managemen ac ion.

We developed a s age-based life-cycle model, cap uring popula ion processes relevan o Pacific salmon ac ing in freshwa er and marine environmen s, and he impac s of harves and environmen al condi ions on juvenile and adul s ages. The underlying model s ruc ure is modular and flexible allowing for reduced complexi y o simpler model forms when da a are limi ed and increased complexi y o address emerging hrea s when da a are available. We included he abili y o model an in egra ed ha chery popula ion, whereby he ha chery and na ural spawning componen s of a popula ion are modelled separa ely bu in erac on he spawning grounds.

SalmonMSE provides advances rela ive o previously available ools ha ei her did no consider risk and uncer ain y or did no consider ha chery dynamics explici ly and herefore could no evalua e performance on ha chery objec ives rela ed o main aining wildness of in egra ed ha chery popula ions, i.e., high PNI values (Wi hler e al. 2018). By explici ly modelling ha chery impac s on popula ions, salmonMSE can evalua e performance on conserva ion, produc ion and ‘wildness’ objec ives. Our applica ion o a case s udy on Sari a River Chinook salmon highligh s he po en ial for rade-offs among objec ives, sugges ing ha in some cases i may no be possible o achieve bo h wildness and high abundances simul aneously. Our case s udy fur her highligh s ha habi a res ora ion may be needed o suppor produc ion objec ives when survival in freshwa er is limi ing. An illus ra ive example is provided in Box 1. This ool fills a cri ical cap in DFO’s abili y o s ra egically evalua e decisions on all hree managemen levers. 

The salmonMSE ool is generic and can be applied across Pacific salmon species and popula ions. salmonMSE can be adap ed o da a availabili y, relying on coarse resolu ion survival ra es (e.g., freshwa er vs. marine) and me a-analyses, neighbouring popula ions, and exper opinion for parame eriza ion when da a are limi ed, and providing popula ion-specific finer life-s age resolu ion and evalua ing managemen ac ions arge ing specific life s ages where da a are available. 

An open-source R package (salmonMSE) was developed o facili a e access of he ool, wi h hree underlying reposi ories providing code for he R package and an applica ion o one case s udy on he wes coas Vancouver Island, Sari a River Chinook, and second on-going applica ion o Upper S rai of Georgia Chinook o suppor he developmen of a Fisheries Science Advisory Repor .","This ool can inform managemen decisions and address rade-offs be ween conserva ion, harves , and ‘wildness’ objec ives wi hin rebuilding plans under Fisheries Ac , Fisheries Science Advisory Repor s, SEP produc ion plans, and SARA lis ing decisions. Fur hermore, he modernized Fisheries Ac requires ha managemen consider he biology of he fish and environmen al condi ions affec ing he s ock, and his ool is designed o accoun for biological charac eris ics like life-his ory diversi y (e.g., accoun ing for differences in survival ra es among life-his ory groups wi hin a popula ion) and environmen al drivers of survival a various life s ages, where da a are available. 

In answering hese ques ions, his ool can inform bo h s ra egic decisions abou choices among managemen lever(s), and opera ional decisions abou harves con rol rules, ha chery release s ra egies and habi a res ora ion.

Uncer ain ies are explici ly considered in salmonMSE in wo ways. Firs , dis ribu ions are included in parame eriza ion and projec ions are run over a large number of random Mon e Carlo rials o accoun for parame er uncer ain ies and o provide probabilis ic ou comes (e.g., he probabili y of achieving managemen objec ives). In his way, he ou comes of managemen evalua ions are less cer ain and probabili ies of achieving objec ives more diffuse when underlying parame ers are more uncer ain. In addi ion, uncer ain ies in model s ruc ure and parame ers can be explici ly considered by running sensi ivi y analyses over a range of plausible hypo heses. These analyses can help o iden ify hose parame ers wi h he highes impac on he rela ive performance of managemen s ra egies, requiring fur her moni oring or research o reduce uncer ain ies.","A raining session for echnical analys s wi hin DFO, Firs Na ions and par ner organiza ions will be hos ed April 2026 o suppor implemen a ion of salmonMSE. The in ended ou comes for he workshop are for par icipan s o unders and he scope and capabili ies of salmonMSE, have working knowledge of how o apply salmonMSE o simple examples ha include in egra ed ha cheries, and unders and how hese can be expanded o include complexi ies in life-his ory diversi y, environmen al drivers, and harves and ha chery managemen s ra egies.

SalmonMSE is curren ly being applied o Upper S rai of Georgia Chinook salmon o inform he evalua ion of harves and ha chery managemen op ions for an upcoming FSAR process (planned for Nov 2026). We recommend he applica ion of salmonMSE o inform fisheries s ock advice for Pacific salmon more broadly, especially when harves and ha chery levers are considered and conserva ion, harves , and PNI objec ives are iden ified. We fur her recommend exploring salmonMSE for SEP produc ion planning, e.g., for evalua ing al erna ive release s ra egies and brood ake rules.

Gaps remain in our abili y o include environmen al drivers and impac s of habi a res ora ion in o salmonMSE. There are oppor uni ies o combine salmonMSE wi h inferences from o her habi a models or limi ing fac ors frameworks, such as CEMPRA (Cumula ive Effec s Model for Priori izing Research Ac ivi ies) and RAMS (Risk Assessmen Me hods for Salmon), and causal modelling (e.g., using DSEM, Dynamic S ruc ural Equa ion Models). Doing so would allow us o more clearly and ransparen ly iden ify and documen risks crea ed by environmen al or ecosys em condi ions for achieving managemen objec ives, and he rela ive benefi s of more specific res ora ion effor s o mi iga e hose impac s."
"PSSI Science Project Reporting - Okanagan juvenile Chinook research.docx","2442","Gradua e Research in o 1) habi a use by juvenile Chinook Salmon in he Canadian Okanagan River and Lake sys em and 2) preda ion on juvenile salmon in he Canadian Okanagan and Lake sys em","Lauren Weir (DFO) Tommy Pon briand (DFO)","Thompson Rivers Universi y (TRU)

Dr Brian Heise 

Selena Carl (MSc s uden )

Torrie Bell (MSc s uden )

Okanagan Na ion Alliance (ONA)

Elinor McGra h","Okanagan River and Lake sys em","Chinook","Okanagan River and Lake sys em","Canadian Okanagan","Canadian Okanagan","CK-01","No applicable.","Juvenile Chinook survival and habi a use:

Subyearling Okanagan Chinook from he kł cp̓əlk̓ s im̓ ha chery (n = 547) were implan ed wi h ATS SS400 injec able acous ic ransmi ers in la e May 2024. 

Fish were released a dusk on 25 May 2024 in wo spa ially dis inc groups o crea e differen migra ion his ories.

A ne work of au onomous acous ic receivers was deployed from Okanagan Falls o Osoyoos Lake (21 May o 8 Augus 2024).

Mobile surveys were comple ed by boa , kayak, and wading, o aling 42 survey days across Vaseux Lake, Osoyoos Lake, and he river be ween la e May and early Augus .

Juvenile Chinook preda ion by Smallmou h bass

Targe ed angling for smallmou h bass was conduc ed in he Okanagan River, Vaseux Lake, and Osoyoos Lake from 3 May o 7 Augus 2024.

Upon cap ure, fish were immedia ely eu hanized hen measured for o al leng h (mm), weighed on a digi al balance scale (g), and sexed by visual inspec ion of he reproduc ive organs. 

The en ire diges ive rac was removed, injec ed wi h 90% e hanol for preserva ion, and frozen for la er labora ory analysis.","The objec ive of his projec was o unders and fac ors influencing he survival of juvenile Chinook Salmon in he Okanagan River and Lake sys em. We found ha survival is low during he downs ream migra ion of sub-yearling Chinook in he spring and early summer. Dis urbed rearing habi a , high wa er empera ures, and preda ion pressure from smallmou h bass were iden ified as he main hrea s o Okanagan Chinook juvenile survival. This new knowledge will help us arge recovery effor s for his endangered popula ion.","The Canadian Okanagan Chinook popula ion is curren ly he only Columbia River basin Chinook popula ion in Canada. Chinook escapemen s o he Okanagan River have been ex remely low (less han 100 spawners annually) and many habi a challenges are preven ing he recovery of he popula ion. Okanagan Chinook were assessed as Endangered by COSEWIC in 2017, and he popula ion is under review for lis ing under he Species a Risk Ac . Some knowledge gaps ha origina ed from hose assessmen s were uncer ain y around juvenile survival and fac ors influencing i . 

To answer his knowledge gap, we par nered wi h Thompson Rivers Universi y o suppor wo gradua e s uden s o s udy fac ors influencing he survival of juvenile Chinook Salmon in he Okanagan River and Lake sys em. The projec was also developed and implemen ed in collabora ion wi h he Okanagan Na ion Alliance’s fisheries biologis Elinor McGra h.","Habi a use and survival:

Subyearling Chinook (n=547) raised in he kł cp̓əlk̓ s im̓ ha chery were implan ed wi h ATS SS400 injec able acous ic ransmi ers. They were released in wo groups, wi h group A (n=273) released in he Okanagan River below Ver ical Drop S ruc ure (VDS) 17 and above Vaseux Lake, and group B (n=274) released downs ream of Vaseux lake below McIn yre Dam. A ne work of 15 ATS SR3001 au onomous receivers was deployed from Okanagan Falls o Osoyoos Lake be ween 21 May and 8 Augus , 2024). Receivers were clus ered in o 7 de ec ion si es, placed o form acous ic “ga es” a lake inle s and ou le s, narrows and channel cons ric ions, and po en ial rearing/migra ion corridors. An ATS SR3017 mobile receiver wi h hydrophone was used o survey shallow side channels, deeper offshore areas beyond s a ionary coverage, and ups ream and downs ream of VDS s ruc ures. The propor ion of fish de ec ed decreased sharply for bo h release groups as fish migra ed downs ream, which ransla ed o low survival in bo h release groups. Tag burden was no deemed a source of direc mor ali y, bu could have increased suscep ibili y o preda ion. 

Smallmou h bass die and preda ion:

Targe ed angling was conduc ed in he Okanagan River, Vaseux Lake, Osoyoos Lake from May 3 o Augus 7, 2024. The dominan species cap ured were smallmou h bass, which comprised 76% of he o al ca ch (n=196), followed by Nor hern Pikeminnow (16%, n=41) and Yellow Perch (4%, n=11). There was a spa ial shif in he dis ribu ion of smallmou h bass caugh during he s udy. In May, less han half (45%) of smallmou h bass were caugh a Ver ical Drop S ruc ures (VDS), bu he propor ion of smallmou h bass cap ured a VDS s ruc ures increased o 100% and 80% in June and July, respec ively. Bass were observed u ilizing rocky subs ra e and rip rap below he VDS s ruc ures o ambush prey. Die con en visual analysis was performed on a subsample of 73 of he o al 196 smallmou h bass. A o al of 162 fish s omach samples were sen for DNA barcode sequencing. Chinook salmon was only de ec ed once in he DNA samples, bu direc evidence of bass preda ion on juvenile Chinook was ob ained by recovery of an acous ic ag used in he juvenile migra ion and habi a use s udy. DNA me abarcoding iden ified a diverse assemblage of 146 unique prey axa. Aqua ic insec s (Dip era, Ephemerop era, Trichop era), invasive fish (smallmou h bass, yellow perch, common carp), and na ive fish (prickly sculpin, moun ain whi efish, sockeye/kokanee, chinook) were he mos common prey i ems in smallmou h bass s omach con en s.","The research conduc ed hrough his projec added grea ly o he limi ed knowledge of juvenile Chinook survival in he Okanagan River and Lake sys em. 

The acous ic eleme ry s udy revealed ha juvenile Chinook survival is low during heir spring ou migra ion in he Okanagan River. I iden ified cri ical freshwa er mor ali y ho spo s in Vaseux Lake, in he Okanagan River, and in he nor hern por ion of Osoyoos Lake. This mor ali y was associa ed wi h warm wa er empera ures and habi a cons rain s, and provides evidence for suppor ing habi a res ora ion s ra egies o increase juvenile survival. Proposed ac ions include:

Reconnec ing side channels

Re-na uralizing riparian zones

Adding deep pools, woody debris, and cover

Managing macrophy e grow h

Adjus ing dam opera ions for cold wa er inflow pro ec ion

Adap ing ha chery release s ra egy ( iming and loca ion) o maximize juvenile survival

The preda ion s udy revealed ha preda ion pressure by na ive and invasive fish species, especially by smallmou h bass, is likely high and con ribu es o he low survival of juvenile Chinook in he Okanagan River and Lake sys em. I also iden ified preda ion ho spo s a Ver ical Drop S ruc ure (VDS) si es on he Okanagan River. Proposed ac ions o mi iga e he impac s of smallmou h bass preda ion include:

Reduce preda ion ho spo s a VDS si es wi h res ora ion effor s o remove or modify exis ing s ruc ures

Targe ed smallmou h bass removal in he Okanagan River and Lake sys em wi h elec rofishing or angling programs

Pro ec and enhance rearing habi a for juvenile Chinook by suppor ing he habi a res ora ion s ra egies lis ed above","The findings from his projec should be considered in he rebuilding and conserva ion plan of his endangered conserva ion uni , as i iden ified specific and angible ac ions ha have he po en ial o increase juvenile Chinook survival, produc ivi y, and abundance of he CU. 

Remaining knowledge gaps and recommenda ions for fu ure s udies include:

Using preda or-de ec ing acous ic ags o de ermine juvenile mor ali y from preda ion and finer-scale movemen da a o elucida e habi a use hroughou he migra ion corridor

Es ima ing he smallmou h bass popula ion size in he Okanagan River and Lake sys em o quan ify he preda ion pressure on juvenile Chinook 

Unders anding he role of preda ion from o her na ive and invasive piscivorous fish and avian preda ors on juvenile Chinook survival"
