"source_file","project_id","project_title","project_leads","collaborators","location","salmon_species","waterbodies","stock","population","conservation_unit","code_software","field_work","highlights","background","methods_findings","insights","next_steps"
"PSSI Science Project Reporting Template Oct2025_Sockeye Steller tagging.docx","2409","Convergen racks: a agging s udy o quan ify salmon preda ion by sea lions",,,"Click or ap here o en er ex .",,,,,"Chilko dominan","Click or ap here o en er ex .","More han 40 acous ic receivers deployed, per year, from char er vessels along he wes coas of Haida Gwaii, Triangle Island, Queen Charlo e S rai , and he S rai of Georgia

Nearly 700 sockeye salmon sampled for leng h and gene ics prior o release from char er purse seine vessel along wes coas Haida Gwaii (2024/25) and Queen Charlo e S rai (2025)

625 sockeye salmon agged wi h acous ic ransmi ers

34 sockeye salmon agged wi h sa elli e ransmi ers

21 adul S eller sea lions were agged on Triangle Island (15 females 2024 & 2025; 7 males 2025)

Be ween 2023-2025, nearly 400 biopsies samples were ob ained direc ly from sa elli e agged animals and random draws by crossbow for fa y acid (FA) and s able iso ope analysis (SI); resul s for 2025 pending

For unknown animals, sex de ermined by gene ic analysis (PBS Molecular Gene ics Lab) o define sex differences in foraging behaviour and die 

Will use valida ed epigene ic clock o genera e discre e age es ima es (UBC-Kobor lab) o define on ogeny in foraging behaviour and die 

To es ablish baselines for die es ima ion, nearly 1500 samples of po en ial ob ained 2023-2025 from DFO In egra ed Pelagic Ecosys em Survey and Groundfish surveys and analyzed for FA and SI; resul s for 2025 pending 

1200 sca s were collec ed concurren ly wi h biopsy sampling. However, due o financial cons rain s, hese samples are curren ly archived for po en ial fu ure analysis","Increased preda ion by S eller sea lions (SSL) has been iden ified as a po en ial cause of declines in Fraser River sockeye salmon abundance; however, here were previously no relevan da a on SSL die s and dis ribu ion or sockeye salmon mor ali y ra es o es he hypo hesis.

We found evidence of high sockeye salmon mor ali y ra es; however, he majori y of mor ali y was associa ed wi h salmon sharks, no SSL. The SSL preda ion ha did occur was concen ra ed in Queen Charlo e S rai , no he larges rookery a Triangle Island. While SSL die resul s are pending, SSL agging da a demons ra ed evidence of res ric ed foraging during he ini ial por ion of sockeye salmon migra ion (as animals are ied o breeding/pupping rookery) followed by rapid dispersal (par icularly by males) away from Triangle Island and diverse foraging s ra egies among individuals. Widespread overlap of he SSL s ock wi h migra ing Fraser River sockeye salmon appears o be less han presumed.

Collec ively, hese resul s sugges sockeye salmon may be vulnerable o a broader range of preda ors han previously considered, and ha preda or communi ies, and preda ion risk, vary hrough space and ime. Thus, previous es ima es of SSL consump ion ra es may be biased high.","Fraser River sockeye salmon produc ivi y has been poor since he early 1990s (Pe erman and Dorner 2012). Al hough he mechanism remains unclear and is likely mul iface ed (Cohen 2012), bo om-up processes ha reduce juvenile marine survival have been iden ified as a likely fac or (McKinnell e al. 2014, Freshwa er e al. 2018, Rechisky e al. 2019). More recen ly, eleva ed preda ion of re urning adul Fraser River sockeye salmon by S eller sea lions (SSL) has been hypo hesized o be a key fac or (Wal ers e al. 2020). The primary pieces of evidence used o infer SSL impac s are a) large increases in SSL popula ion size coinciden wi h Fraser River sockeye salmon declines, b) he loca ion of large SSL breeding colonies proxima e o sockeye migra ion corridors (e.g., Triangle Island rookery a he nor hwes ip of Vancouver Island is he larges in nor heas Pacific), and c) bioenerge ic modeling ha es ima ed significan removals (>1 million individuals) by SSLs if sockeye are 40% of he die during four weeks in summer and all SSLs a Bri ish Columbia rookeries arge sockeye during his period (Wal ers e al. 2020). Ye because here are no published es ima es of SSL die nor foraging dis ribu ion from rookeries and haul ou s adjacen o sockeye salmon migra ion corridors, our curren unders anding of SSL foraging ecology is insufficien o valida e key model assump ions. Fur hermore, previous empirical es ima es of sockeye salmon survival during heir marine migra ions do no have sufficien resolu ion o evalua e SSL impac s (Crossin e al. 2007, 2009). As a resul , he impac of SSL, and o her marine preda ors, on Fraser River sockeye salmon remains uncer ain.","We used mul iple me hods o evalua e SSL foraging ecology, quan ify sockeye salmon mor ali y ra es, and ul ima ely draw inference on he likely impac of SSLs on migra ing Fraser River sockeye salmon. The following ac ivi ies occurred during he 2024 and 2025 field seasons (Figure 1). 

Sockeye Salmon Me hods

Sockeye salmon were cap ured aboard a char er purse seine vessel from si es near Rennell Sound (wes coas Haida Gwaii; 2024 and 2025) and Queen Charlo e S rai (2025 only). Sockeye salmon were landed and ransferred o a flow hrough seawa er rough where biological da a, including gene ic s ock iden ifica ion (GSI) samples, were collec ed. Individuals in good physical condi ion were agged wi h ei her an acous ic or sa elli e ag before being immedia ely released. We deployed acous ic ransmi ers on sockeye salmon (n=625) which allowed individuals o be de ec ed on moored receiver arrays near Haida Gwaii, Triangle Island, Queen Charlo e S rai , hroughou he Salish Sea, and he lower Fraser River. The acous ic receiver ne work included approxima ely 40 receivers deployed by DFO hroughou coas al Bri ish Columbia, as well as infras ruc ure main ained by NOAA, he Ocean Tracking Ne work, Kin ama, and he Universi y of Bri ish Columbia. De ec ions da a will be used o parame erize mark-recap ure models o es ima e survival ra es along he migra ion corridor and iden ify ho spo s of mor ali y. We also deployed popup archival sa elli e ags (PSATs) on a smaller number of sockeye salmon (n=35). Af er releasing from he animal hese ags ransmi ligh , empera ure, and pressure sensor da a ha can be used o iden ify preda or axa (Sei z e al. 2019). 

Sockeye Salmon Findings

GSI resul s are curren ly only available for he 2024 field season; however, he majori y (>98%) of agged sockeye salmon were iden ified as belonging o Fraser River popula ions wi h Chilko Lake being he dominan conserva ion uni (~55% of all samples). Only a subse of de ec ions da a are curren ly available for 2025; however preliminary resul s in bo h years (Figure 2) indica e overall survival from Haida Gwaii o he Fraser River was poor (<8%). ~50% of individuals agged a nor hern si es were de ec ed on Haida Gwaii arrays; however, mark-recap ure models ha accoun for imperfec de ec ion probabili y on hese arrays are required for robus es ima es of survival. Survival o he Fraser River of ags deployed in Queen Charlo e S rai was markedly higher (~40%). 2% of ags were de ec ed in he s udy area af er deploymen s were comple ed, sugges ing shor - erm mor ali y due o agging or handling was minimal. Only wo ags were de ec ed a Triangle Island (bo h in 2025), however 46 ags were de ec ed in 2025 a sea lion haul ou s hroughou Queen Charlo e S rai . Impor an ly, addi ional analysis is required o de ermine how many of hese fish were likely consumed by pinnipeds based on subsequen de ec ions. No fish were repor ed as in ercep ed by fisheries in 2024, bu 5% of agged fish were recap ured by marine and in-river fisheries an","Al hough analyses are underway, here are several key preliminary resul s. We found ha sockeye salmon mor ali y ra es during adul marine migra ions may be considerably higher han previously assumed (e.g. Cohen 2012). A he same ime, i is clear ha he preda or communi y varies along he migra ory corridor—while we found some evidence of pinniped preda ion in Queen Charlo e S rai ha warran s addi ional inves iga ion, we found no evidence of pinniped preda ion near Haida Gwaii where mor ali y ra es were high and apparen ly driven by shark preda ion. Similarly, we found evidence ha preda ion impac s likely vary among and wi hin sea lion haul ou s. Despi e he large size of he Triangle Island rookery, we found a very small number of ags a his loca ion, par icularly rela ive o Queen Charlo e S rai haul ou s. 

S eller sea lion sa elli e ag pa hs highligh impor an nuances in foraging behaviour during he mon hs when Fraser River sockeye salmon are available. A his ime of year, ma ure SSL are ied o pupping, nursing and breeding wi h only in ermi en foraging. Peak pupping ypically occurs early July. Females s ay wi h heir pups fas ing for 1-2 weeks af er which hey make shor foraging rips. Females appeared o disperse from Triangle by mid-Augus o o her haul ou s around Queen Charlo e Sound and WCVI. Males had very limi ed movemen s during he breeding period. Rapid and direc ed dispersal immedia ely pos breeding (mid-July) was observed. Despi e he large number of animals concen ra ed on Triangle Island during he breeding period (coinciden wi h sockeye salmon migra ion), adjacen wa ers do no appear o be a major feeding ground his ime of year. These foraging and dispersal pa erns generally run coun er o blanke assump ions for SSL impac s on sockeye and will have implica ions for foraging models. Ongoing die analyses will provide addi ional informa ion on individual, spa ial, and seasonal variabili y in S eller sea lion foraging. 

Our resul s emphasize he impac s of a leas hree preda or axa (salmon sharks, blue sharks, S eller sea lions) on sockeye salmon warran addi ional considera ion. Given a po en ial la i udinal gradien in shark abundance (Williams e al. 2010, Proudfoo e al. 2024), popula ion level impac s may be sensi ive o where Fraser River sockeye salmon in ercep he con inen al shelf during heir re urn migra ions. All else being equal, fish making landfall near Haida Gwaii will migra e hrough a longer gaun le of preda ors han hose making landfall in Queen Charlo e Sound, which may in urn be a grea er risk han hose migra ing hrough Juan de Fuca S rai . The loca ion of landfall is uncer ain, bu if i is correla ed wi h diversion ra e, as seems likely, will vary among s ocks as well as among years (Gran e al. 2017). If we find evidence of year-specific differences in survival ra e, consis en wi h expec ed densi y dependen effec s on preda or foraging behaviour, his will add subs an ial addi ional variabili y due o sockeye salmon cyclici y. In shor , a fixed, av","Our findings highligh successful ecosys em-based managemen of sockeye salmon requires careful considera ion of fac ors ha are of en overlooked when quan ifying preda or impac s. Firs , s udies on preda ion impac s have focused on ce aceans and pinnipeds (Chasco e al. 2017a & b, Wal ers e al. 2020, Nelson e al. 2024), which have robus ime series of abundance. However, he effec of pinniped impac s will be biased high if he abundance of mul iple preda or axa have increased in synchrony. In his scenario, reducing ce acean or pinniped effec s may simply resul in he remaining preda or axa increasing in abundance. Second, bioenerge ics models are commonly used o quan ify he popula ion level impac of preda ors (Chasco e al. 2017a & b, Wal ers e al. 2020); however, hese me hods are sensi ive o assump ions abou he rela ive con ribu ion of differen species and size classes o he die (Nelson e al. 2021). These uncer ain ies are fur her amplified by seasonal and spa ial variabili y in preda or die s, as well as differences among individuals in foraging behaviour. Finally, he o al impac on prey species is also sensi ive o he propor ion of he prey popula ion ha is vulnerable o preda ion. Our findings sugges ha each of hese componen s is highly relevan when evalua ing S eller sea lion impac s on Fraser River sockeye salmon. 

In par icular, we sugges ongoing and fu ure work should address he following major dimensions. Seasonal and spa ial variabili y in S eller sea lion die s should be quan ified— his work will proceed using collec ed biochemical racers. Seasonal, sex-specific variabili y in S eller sea lion dis ribu ions should be used o es ima e he rela ive propor ion of he popula ion ha is likely o overlap spa ially and emporally wi h migra ing sockeye salmon— his work could proceed using exis ing sa elli e and overfligh survey da a. S eller sea lion dis ribu ions should be paired wi h es ima es of in erannual and s ock-specific variabili y in sockeye salmon migra ion rou es o evalua e rela ive risk— his work is proceeding using his orical ca ch da a, bu i is curren ly unclear whe her exis ing da a are sufficien . Since salmon-preda or in erac ions are highly con ex -dependen (Wells e al. 2025), un il he above da a gaps are addressed effor s o mi iga e preda or impac s should proceed wi h cau ion and a careful considera ion of he associa ed uncer ain ies."
"PSSI Science Project Reporting Template_JessyBokvist_Part1&2.docx","2407","Charac erizing juvenile Chinook salmon dis ribu ion, die and heal h on he Wes Coas of Vancouver Island.",,,"Wes Coas of Vancouver Island, S amp River, Sari a River, Ni ina River, Barkley Sound","Chinook","Salmon

Sooke Basin, Por San Juan, Ni ina Lake, Barkley Sound, Clayoquo Sound, Noo ka Sound, Kyuquo Sound, Qua sino Sound",,,"CK-31, CK-32, CK-33","Da a dashboard (in progress) ha will be hos ed a Fisheries Map Gallery.","In collabora ion wi h 17 Firs Na ions, and 12 Non-Governmen al Organiza ions (NGOs), his projec has caugh and sampled juvenile Chinook during heir firs marine year on he WCVI. Salmon surveys aimed o “follow” juvenile Chinook salmon as hey en er marine wa ers from heir na al rivers, and hrough he summer and firs marine win er as hey rear along he Wes Coas of Vancouver Island (WCVI). 

From 2023-2024, Chinook origina ing from S amp River, Sari a River and Ni ina River were caugh during heir marine ou migra ion using seining and dip ne ing me hods. In he S amp River and Somass es uary, juvenile Chinook origina ing from S amp River were caugh hrough dip ne and beach seine surveys wi h Hupacasa h Firs Na ion. In he Sari a Es uary, beach and purse seine surveys were led by Huu-ay-ah Firs Na ion and LGL Limi ed and da a and samples were shared wi h his projec . In Ni ina Lake, beach seine surveys were carried ou wi h Di idah Firs Na ion o ca ch juveniles from he Ni ina River popula ion. Juvenile Chinook from hese popula ions were hen caugh during heir firs marine summer in Barkley Sound via purse seine surveys from 2022-2025 in collabora ion wi h Huu-ay-ah Firs Na ion and LGL Limi ed. Finally, juvenile salmon were followed hrough heir firs win er a sea wi h micro rolling surveys carried ou in nearshore marine wa ers in Sooke Basin hrough Qua sino Sound on he WCVI. These overwin er surveys were carried ou wi h 27 local Firs Na ion and NGO collabora ors from 2020-2025.","Click or ap here o en er ex .","Click or ap here o en er ex .","Click or ap here o en er ex .","Click or ap here o en er ex .","Click or ap here o en er ex ."
