"source_file","project_id","project_title","project_leads","collaborators","location","salmon_species","waterbodies","stock","population","conservation_unit","code_software","field_work","highlights","background","methods_findings","insights","next_steps"
"ARoss_Biotoxins_PSSI Science Project Reporting Template_26Jan2026.docx","2416","Moni oring and predic ing he exposure of Pacific salmon o harmful algal bio oxins",,,"Ins i u e of Ocean Sciences","Chinook","Barkley Sound",,,"Click or ap here o en er ex .","N/A","Mon hly collec ion and fil ra ion of wa er samples for algal bio oxin analysis a 5 krill survey si es in Barkley Sound, and collec ion and dissec ion of juvenile WCVI Chinook salmon issues for bio oxin analysis a salmon survey loca ions close o krill survey si es, from July 2023 o November 2025.","o assess he risk posed by harmful algal bio oxins o juvenile WCVI Chinook in heir cri ical habi a .

juvenile WCVI Chinook salmon are exposed o and ake up harmful algal bio oxins in Barkley Sound. 

bio oxins known o harm fish peak in summer/fall in Barkley Sound in bo h wa er and fish issues.

resul s sugges ha bio oxin exposure/impac s can be mi iga ed e.g. via iming of ha chery releases.","Bio oxins produced by harmful algae are know o cause illness and mor ali y in marine animals including juvenile fish (Lefebvre e al., 2005). Regular moni oring of harmful algal bio oxins in B.C. coas al wa ers since 2020 (Ross e al., 2025b) has revealed significan correla ions be ween clima e variables (e.g. wa er empera ure) and he concen ra ions of hese oxins in areas known o be frequen ed by Pacific salmon. These include a -risk WCVI Chinook salmon popula ions, for which harmful algae were iden ified as an emerging hrea during he WCVI Chinook Rebuilding Plan Marine Risk Assessmen (MRA) Workshop #3 held in April 2022. However, he levels of harmful algal bio oxins o which juvenile WCVI Chinook salmon are exposed in cri ical habi a s such as Barkley and Clayoquo Sounds are unknown. This is an impor an knowledge gap, given ha low early marine survival is con ribu ing o declines in WCVI Chinook and o her Pacific salmon popula ions. 

The goal of his PSSI ‘Follow he Fish’ projec was o build upon our Bio oxin Moni oring Program (Ross and Mueller, 2024) by adap ing es ablished analy ical me hods and procedures o measure harmful algal bio oxins in juvenile WCVI Chinook salmon issues (gill, liver) and habi a (Barkley Sound) using samples collec ed by ‘Follow he Fish’ krill and salmon survey eams, in par nership wi h local Firs Na ions. This informa ion is being combined wi h environmen al da a (wa er proper ies, eDNA), assessmen s of fish heal h and condi ion (biome rics, gene expression), and informa ion on life his ory (o oli h microchemis ry) o help forecas and po en ially mi iga e early marine exposure of WCVI Chinook salmon o harmful algal bio oxins, and associa ed impac s on heir heal h and survival.","Harmful algal bio oxins were measured in sea wa er using he me hod developed for our Marine Bio oxin Moni oring Program (Ross and Mueller, 2024). Surface sea wa er was collec ed a 5 loca ions in Barkley Sound (Fig. 1) during krill surveys carried ou a he beginning of each mon h and fil ered on board o ob ain fil er and fil ra e samples, from which bio oxins were ex rac ed and analyzed by liquid chroma ography and andem mass spec rome ry o ob ain dissolved and par icula e bio oxin concen ra ions (Ross e al., 2025a). These were combined o ob ain mon hly values of o al bio oxin concen ra ion a each loca ion (Fig. 2). To assess exposure o harmful algal bio oxins, juvenile WCVI Chinook salmon cap ured by purse seining close o krill survey loca ions were dissec ed o ob ain gill and liver issue samples, which were pooled as necessary o ob ain sufficien ma erial for analysis. 

Produc s and ools developed during his projec include a Regional Bio oxin Da abase (in progress) for organizing, s oring and re rieving bio oxin and rela ed environmen al, biological, and axonomic informa ion for sea wa er and biological samples collec ed during his projec (and he Marine Bio oxin Moni oring Program) wi h he goal of making i available o co-workers via DMApps. 

Advances in me hodology during his projec include procedures o minimize cross-con amina ion while dissec ing and pooling of issues for bio oxin analysis, and adap a ion of he me hod for sea wa er analysis o measure harmful algal bio oxins in very small amoun s of issue, hereby allowing hem o be s udied in individual fish, organs and/or early life s ages (Mueller e al., in prepara ion). 

Examples of communica ion and knowledge ransfer include a Newsle er (Ross and Lose o, 2025) ha describes he moni oring of bio oxins and con aminan s during he PSSI ‘Follow he Fish’ projec . Resul s from he moni oring of bio oxins in Barkley Sound during fall 2023 were also included in a repor prepared for Snuneymuxw Firs Na ion (Ross, 2024) on he measuremen of harmful algal bio oxins near Nanaimo a he same ime, o provide con ex for he in erpre a ion of hose resul s. Knowledge abou seasonal rends in bio oxin concen ra ion ob ained during his projec , and how i can be used o mi iga e risks associa ed wi h bio oxin exposure in juvenile salmon hrough he iming of ha chery releases, was presen ed during a Fish Heal h & Ha chery Biology Seminar (Ross, 2025). 

Key resul s include:

de ec ion and iden ifica ion of seasonal pa erns in he concen ra ions of harmful algal bio oxins in Barkley Sound, including hose know o be harmful o juvenile fish (Fig. 2).

de ec ion of cer ain bio oxins in he issues of juvenile WCVI Chinook salmon presen in Barkley Sound when hose bio oxins are rela ively abundan in he surrounding wa er (June o Sep ember).

recogni ion ha WCVI Chinook are being exposed o harmful algal bio oxins in heir cri ical habi a during early marine life s ages, a levels sufficien o cause up ake in gill and liver issues (Fig. 3).","This projec has revealed ha juvenile WCVI Chinook salmon presen in Barkley Sound during la e summer are exposed o harmful algal bio oxins a levels sufficien o cause up ake in heir issues. 

bio oxins presen in Barkley Sound follow seasonal rends similar o hose observed elsewhere in B.C. coas al wa ers (Fig. 2).

juvenile WCVI Chinook salmon in Barkley Sound are exposed o increasing levels of algal bio oxins from May onwards, par icularly a cen ral and ou er loca ions (Coas er, Swale, Mackenzie: Fig. 1).

exposure of juvenile WCVI Chinook salmon o bio oxins is confirmed by de ec ion of domoic acid, yesso oxin, and he paraly ic shellfish poisoning (PSP) oxin saxi oxin in gill and/or liver issue from purse seined fish caugh in Barkley Sound in la e summer 2023 and/or 2024.

levels of bio oxins de ec ed in issues seem o correla e wi h hose in he surrounding wa er (Fig. 3).

Resul s from our Marine Bio oxin Moni oring Program sugges ha cer ain bio oxins including hose harmful o juvenile fish are rending upwards in B.C. coas al wa ers, and ha higher bio oxin levels may be associa ed wi h clima e-rela ed fac ors such as increasing empera ure and/or nu rien limi a ion due o s ra ifica ion caused by higher empera ures or freshwa er inpu s (Ross a al., 2025). 

Tools are being developed (CSRF projec 2025-26-11-07) o predic fu ure levels of bio oxin exposure and up ake based upon linkages wi h environmen al condi ions measured a he same ime. This will allow DFO o forecas and po en ially mi iga e levels and impac s of bio oxin exposure in WCVI Chinook; for example, by iming he release of ha chery fish o minimize exposure (Ross, 2025). 

Meanwhile, gene expression analysis is being carried ou (Ar Bass e al.) o see whe her observed levels of bio oxin exposure resul in s ress responses, biological effec s and/or heal h impac s in juvenile salmon, hereby helping o iden ify biologically significan hresholds of exposure for hese limi ing fac ors.

We are working wi h he Con aminan s group (Lisa Lose o e al.) o inves iga e he separa e and cumula ive effec s of bio oxins and con aminan s on juvenile WCVI Chinook salmon, aking advan age of he observed seasonal rends in bio oxin exposure.

We are also working wi h he O oli h Microchemis ry group (Nicole LaForge, Micah Quindazzi) o rela e bio oxin exposure and impac s o life s age and his ory (e.g. es uary residence ime, age a en ry) for specific popula ions (Sari a, Rober son), and wi h he eDNA group (Chris oph Deeg e al.) on in erac ions of juvenile WCVI Chinook salmon wi h harmful algae and o her marine species.

In addi ion o providing o al bio oxin concen ra ions, he analysis of fil er and fil ra e samples (Ross e al., 2025a) allows us o compare bio oxin levels in differen salmon issues wi h dissolved and par icula e bio oxin concen ra ions in he surrounding wa er, and o see if he da a suppor a par icular pa hway of exposure (e.g. up ake via inges ion would likely give a be er correla ion wi h par icula e bio oxin","Remaining knowledge gaps include addi ional moni oring da a wi h which o es ablish longer- erm rends in bio oxin produc ion in Barkley Sound and how hese may rela e o clima e change. They also include fu ure da a on adul re urns and indica ors of heal h, recrui men , e c. for salmon ha were exposed o he observed concen ra ions of bio oxins in Barkley Sound during his projec (i.e. from July 2023 o November 2025). This will allow long- erm risks associa ed wi h ‘carry forward’ impac s of bio oxin exposure o be assessed, along wi h any early marine life s age impac s revealed by gene expression analysis and/or biome ric indica ors of fish heal h in juvenile salmon during his projec . 

Meanwhile, he findings of his projec can be opera ionalized by incorpora ing informa ion on he emporal and spa ial dis ribu ions of harmful algal bio oxins in Barkley Sound (Figs. 1 and 2) in o he scheduling of ha chery releases for differen popula ions (Sari a, Rober s on) based on knowledge of heir migra ion behaviour (incl. sal wa er en ry and es uarine residence imes) o minimize bio oxin exposure and impac s in juvenile salmon. The observed rela ionships be ween bio oxin levels in fish issues and dissolved, par icula e and/or o al bio oxin concen ra ions (Fig. 3) in he surrounding wa er can also be used o help iden ify pa hways of exposure and evalua e curren and fu ure risks posed by measured and projec ed bio oxin concen ra ions o juvenile WCVI salmon in Barkley Sound."
"PSSI Science Project Report - Geospatial Indicators - Jan232026.docx","2425","Geospa ial Indica ors and Me rics for Threa s o Fish Habi a in he Fraser River Basin wi h Thompson-Nicola as a Case S udy",,,"Fraser River Basin","Chinook","Coho, Chinook, Sockeye, Pink, Chum

Fraser River",,,"CK-03, CK-04, CK-05, CK-06, CK-07, CK-08, CK-09, CK-10, CK-11, CK-12, CK-14, CK-16, CK-17, CK-18, CK-19, CO-05, CO-07, CO-08, CO-09, CO-48, SEL-03-02, SEL-03-03, SEL-03-04, SEL-04-01, SEL-05-02, SEL-06-07, SEL-06-10, SEL-06-11, SEL-06-13, SEL-06-14, SEL-06-16, SEL-07-01, SEL-09-xx, SEL-10-01, SEL-10-03, SER-02, CK-13, CK-15, CK-82, CM-02, CO-04, CO-47, PKE-9005, PKO-01, SEL-03-01, SEL-03-05, SEL-06-01, SEL-06-02, 

SEL-06-20, SEL-09-02, SEL-09-03, SER-03","Code shared as needed upon reques .","Click or ap here o en er ex .","Human ac ivi ies, landscape dis urbances, and clima e change are presen ing numerous individual and cumula ive hrea s o fish and heir freshwa er habi a across Bri ish Columbia (BC). Modern ools and approaches for racking and assessing hese hrea s are needed o suppor responsive and in egra ed regula ory, planning, par nership, and moni oring ac ivi ies o help safeguard fish and fish habi a .

We developed geospa ial es ima es of individual and cumula ive hrea s o salmon and Species A Risk habi a in he Fraser River Basin from human ac ivi ies, landscape dis urbance, and clima e change (e.g. pollu an loading, sedimen a ion, flow al era ion, high s ream empera ures). We modelled and mapped 13 hrea s for he full s ream ne work and iden ified where and for which species hrea s were higher. We fur her applied he hrea scores and indica ors of impor an habi a for salmon in he Thompson-Nicola o help inform res ora ion planning for salmon ecosys ems.

This projec is he firs o provide spa ially ex ensive es ima es of freshwa er hrea s o salmon and inform how res ora ion and managemen ac ions can po en ially improve popula ion ou comes. The es ima ed hrea s are now used in salmon popula ion life-cycle modelling o evalua e he impac on salmon across heir freshwa er life cycle.","Unders anding where and how fish and fish habi a are impac ed by human ac ivi ies and clima e change is cri ical informa ion for arge ing effec ive conserva ion and managemen ac ions o help preserve popula ions. Geospa ial cumula ive effec s assessmen s offer a powerful approach for evalua ing simul aneous hrea s across large spa ial scales, improving upon radi ional field-based assessmen s (Halpern e al. 2008a; Halpern and Fuji a 2013). However, many exis ing assessmen s rely on simple proxies of human ac ivi y (e.g., road densi y) ra her han mechanis ic me rics ha direc ly link s ressors o ecological responses relevan o fish and fish habi a (e.g., sedimen loading or flow al era ion) o provide more meaningful applica ions (e.g., s ressor-response curves; Rosenfeld e al. 2022). To address his gap, his projec advanced exis ing geospa ial ools, indica ors, and hrea me rics for he Pacific Region (DFO 2022) by incorpora ing a mechanis ic approach o be er quan ify an hropogenic and clima e change impac s and inform managemen ac ions for salmon and Species a Risk (SAR) in he Fraser River Basin (FRB).

The Thompson-Shuswap and Nicola River wa ersheds were iden ified as pilo areas o deliver In egra ed Planning for Salmon Ecosys ems (IPSE) under he Pacific Salmon S ra egy Ini ia ive (PSSI). Wi hin he scope of his projec , we conduc ed a case-s udy on he Thompson-Nicola Ecological Drainage Uni (EDU) by developing examples of how individual and cumula ive hrea scores can be applied o help inform res ora ion priori iza ion and managemen ac ions. The Thompson-Nicola spa ial analysis was used o inform IPSE collabora ive planning processes in he Thompson-Nicola wa ersheds.","We developed a geospa ial ool o summarize an hropogenic and clima e change rela ed cumula ive hrea s o freshwa er species and habi a s using open-source inpu da a and sof ware ha can be reproduced for differen ime periods and freshwa er species and heir habi a s. All hrea s were es ima ed for each s ream reach wi hin he BC Freshwa er A las (FWA). We derived nine individual human-ac ivi y and landscape dis urbance hrea s: aqua ic invasive species, riparian dis urbance, in-s ream habi a des ruc ion, flow al era ion, la i udinal fragmen a ion, sedimen a ion, pollu an loading, and nu rien loading. The inpu da a was processed and combined o produce an individual hrea score ha charac erizes he mechanism of dis urbance o freshwa er species for each score. For clima e change hrea s, we compiled model ou pu s of projec ed s ream flow and empera ure o es ima e hrea s of flood-risk, low and high s ream flow, and high summer s ream empera ure from 2040-2060 under Represen a ive Concen ra ion Pa hway (RCP) 4.5 and 8.5 scenarios. The individual hrea scores were s andardized across he s udy area, weigh ed equally, and added oge her o calcula e a human ac ivi y and landscape dis urbance cumula ive hrea score and a clima e change based cumula ive hrea score (see Iacarella e al. 2025 for de ailed me hods). Finally, bo h cumula ive hrea scores were paired wi h salmon and SAR dis ribu ions (i.e., CU boundaries and delinea ed s ream habi a s, respec ively) and evalua ed o iden ify where hrea s were grea es and which species and CUs were exposed o he highes hrea levels.

For he Thompson-Nicola EDU case s udy, we focused on human ac ivi y hrea s ha may reasonably be mi iga ed, including riparian dis urbance, wa er wi hdrawal, and longi udinal fragmen a ion from dams. We iden ified overlap be ween hese hrea s and wo approaches used o iden ify areas impor an o salmon: (1) CU delinea ions and (2) modelled environmen ally favourable spawning habi a s. The modelled environmen ally favourabili y predic ions were derived from large-scale environmen al niche models o predic shif s in habi a favourabili y from curren o fu ure clima e condi ions (Iacarella and Weller 2023). We mul iplica ively combined hrea scores wi h environmen al favourabili y for salmon spawning o crea e composi e scores ha reflec a gradien of po en ial managemen implica ions (see Fig. 20 in Iacarella e al. 2025). A high hrea score combined wi h a high favourable habi a probabili y iden ifies an area ha warran s localized inves iga ion and po en ial res ora ion or mi iga ion ac ions. Conversely, a low hrea score combined wi h a low favourable habi a probabili y iden ifies an area ha is less likely o need managemen a en ion based on salmon values (i.e., predic ed spawning habi a ) and low level of an hropogenic impac . 

Our resul s indica ed he highes cumula ive hrea scores around he lower Fraser River and wi hin he in erior pla eau of he FRB for bo h human ac ivi y and landscape dis urbance based hrea s and","This projec is he firs o provide spa ially ex ensive es ima es of human ac ivi y and clima e change hrea s ha are direc ly linked o salmon, SAR, and heir habi a s a he s ream reach scale. The approaches used o es ima e each of he indica ors provide an ini ial broad-scale s andardized framework ha can be applied o charac erize hrea s hroughou he Pacific Region. Wi hin he FRB, we observed he highes hrea s in he Lower Fraser and in erior pla eau, and specifically, wi hin he Nicola River, Guichon Creek, and San Jose River. Overall, roads were he grea es con ribu or o human ac ivi y-based hrea s, dis urbing in-s ream habi a s, riparian areas, and con ribu ing o sedimen and nu rien loading. These resul s improve our unders anding of he spa ial dis ribu ion and rela ive magni ude of hrea s across he FRB, providing a founda ion for predic ing popula ion-level impac s from cumula ive effec s and life-cycle modelling. 

 A major source of uncer ain y is he spa ial accuracy of he BC Freshwa er A las. Known issues o he FWA include overes ima es of headwa er s reams in in erior regions, misaligned s ream delinea ions and large river ca chmen areas. Each of he individual hrea scores have heir own uncer ain ies and limi a ions, as de ailed in Table 2 of Iacarella e al. (2025). In general, he inpu da a are subjec o limi a ions arising from po en ially misclassified land cover or land use, fea ures included in da ase s bu no presen on he landscape, and unmapped ac ivi ies or fea ures, which in roduce uncer ain y in o individual hrea scores and he cumula ive score. An addi ional source of uncer ain y is he unresolved habi a use and dis ribu ion of salmon and SAR wi hin he FRB. The approach used o combine individual hrea s in o a cumula ive hrea score (e.g., addi ion, mul iplica ion, e c.) is ano her source of uncer ain y ha can be evalua ed in fu ure work by modelling popula ion responses o individual and cumula ive hrea s.","Al hough our hrea es ima es represen he mechanisms by which salmon and freshwa er SAR are affec ed, he magni ude a which hese hrea s influence salmon popula ion dynamics remains unknown. To address his gap, we are con inuing o refine exis ing hrea es ima es and developing new hrea s ha are explici ly linked o s ressor-response func ions for cumula ive effec s and life-cycle modelling. For example, we have developed addi ional riparian dis urbance me rics ha be er cap ure he impac s o riparian func ion (e.g., large-woody debris recrui men , dis urbance o s ream-shading, riparian fil ering), which were no included in he original repor . Moreover, we are developing a s age-s ruc ured popula ion model for In erior Fraser Coho (IFC) o es ima e how s ressors (es ima ed hrea s) are influencing he popula ion across heir freshwa er life s ages. For his work, we are u ilising he Cumula ive Effec s Model for Priori izing Recovery Ac ions (CEMPRA), which applies s ressor-response func ions o accoun for he impac of s ressors on vi al ra es and he overall popula ion over ime and under differen clima e change and mi iga ion scenarios (Bayly e al. 2024). 

 Addi ional nex s eps for his work include expanding he cumula ive hrea s model o o her wa ersheds in he Pacific Region. To da e, he model has also been applied o he Upper Bulkley Wa ershed o aid in salmon habi a res ora ion planning. Valida ion is an impor an s ep of mos modelling exercises, hough is of en no a s andard componen of cumula ive effec assessmen s (Halpern and Fuji a 2013). Valida ing hese hrea s hrough field verifica ion and in si u da a would be beneficial for hrea s ha involve applied rela ionships and es ima ions, such as he flow accumula ed loadings (i.e., nu rien s, pollu ion, sedimen a ion). Fu ure work could re-run he model a regular in ervals o evalua e change in hrea s over ime. Finally, addi ional analyses could quan ify uncer ain y in modelled hrea s and evalua e underlying assump ions hrough sensi ivi y es s."
