"source_file","project_id","project_title","project_leads","collaborators","location","salmon_species","waterbodies","stock","population","conservation_unit","code_software","field_work","highlights","background","methods_findings","insights","next_steps"
"PSSI Science Project Reporting 2439.docx","2439","Modernizing Fish Age Es ima ion using Fourier Transform-Near Infrared and Neural Ne work Techniques",,,"Pacific Biological S a ion Nanaimo, BC","Chinook","Chum and Chinook

Click or ap here o en er ex .",,,"Click or ap here o en er ex .","R-scrip for he processing of o oli h images, weigh s and IR scans for he predic ive assessmen of rockfish age, s ock ID and specia ion. 

Py hon code for Efficien Ne V2L, NASNe Large, and ConvNeX Large for Chum salmon image classifica ion and regression models.","NA – no field work componen","The Al erna ive Age Es ima ion program (AAE) in he Sclerochronology lab (SCL) is conduc ing research in Convolu ional Neural Ne work (CNN) and Deep Machine Learning (DML) predic ive age modeling wi h a goal o deploy an AI-driven pipeline ha augmen s radi ional ageing echniques and ransforms fish age es ima ion.

Chum Salmon CNN predic ive age models for he mos common age classes have been very successful, a aining precision ra es up o 94% (Ames e al. submi ed CJFAS 2025). Fourier Transform-Near Infrared (FT-NIR) spec roscopy and O oli h Shape Analysis (OSA) have provided accep able age predic ions for Rougheye/Blackspo ed (REBS complex), Yelloweye and Pacific Ocean Perch rockfish and have demons ra ed excellen resul s for he REBS complex specia ion and Yelloweye s ock ID. 

The s eadily increasing demand for age da a regularly exceeds program capaci y, and wi h he SCL experiencing reduc ions in funding and skilled personnel, radi ional age es ima ion has become a bo leneck in providing age da a for he managemen of Pacific salmon. Au oma ion of he age assignmen process for salmon and rockfish species will facili a e increased capaci y and supplemen exis ing personnel providing key model age da a o ensure fisheries are sus ainably managed.","The SCL program provides approxima ely 120,000 quali y con rolled age-es ima es for salmon and groundfish species annually. Age da a are inpu s in calcula ing ra es of reproduc ivi y, grow h and mor ali y, cri ical componen s in s ock produc ivi y and are key parame ers in s ock assessmen analyses. Provision of imely age da a es ima es enables downs ream modelling of s ocks performance and allow for hese informa ion o be available for consul a ion processes which are pivo al for sus ainable fisheries managemen , conserva ion s ra egies and ecological research. The s eadily increasing demand for age da a regularly exceeds program capaci y forcing reques s o be aged on a priori ized basis, wi h he SCL experiencing reduc ions in funding and skilled personnel, radi ional age es ima ion has become a bo leneck in providing age da a for he managemen of Pacific salmon and groundfish (Malde e al. 2020). 

Tradi ional echniques, such as scale and o oli h age assignmen are labour in ensive, ime consuming, and prone o in er-reader variabili y. Improved and accelera ed age es ima es hrough he deploymen of an AI-driven pipeline of CNN and DML predic ive age modeling will augmen radi ional ageing echniques and ransform fish age es ima ion (Moen e al. 2023; Vabø e al. 2021).

A mul iple agency effor (DFO, Pacific S a es Marine Fisheries Commission (PSMFC), Na ional Oceanic and A mospheric Adminis ra ion (NOAA), Alaska Depar men of Fish and Game (ADF&G) and he Nor hern Sou heas Regional Aquacul ure Associa ion (NSRAA)) have developed working models o successfully predic Chum ages wi h an AI algori hm rained on 15,000 scale images. Al hough he exis ing models are coas wide (Alaska, BC and Washing on), our research eam is curren ly supplemen ing BC images o increase he robus ness of he coas wide models while developing new models specific o Chum salmon cap ured in wa ers local o BC. 

This is he firs s ep in providing a mul i-species Al erna ive Age Es ima ion pipeline designed o augmen age assignmen ou pu capaci y wi hin he SCL.","For any AI predic ive age model o func ion i requires inpu da a or a ribu es, hese are ypically species and s ruc ure dependen . The SCL has focused on he a ribu es ex rac ed from scales and o oli hs for i s inves iga ions in o predic ive age assignmen (Table 1).

In he case of salmon, specifically Chum he scale grow h pa ern is he a ribu e and a scale image is he means of in erpre a ion (LaLanne and Safs en 1969; McNicol and MacLellan 2010). Chum salmon scales were collec ed by four agencies: NOAA, ADF&G, NSRAA and DFO. All groups prepare scales similarly for age es ima ion; scales are moun ed o a gum card and ace a e impressions are made. An au oma ed high-speed Leica Emspira 3 mobile base camera sys em was used o selec ively and rapidly image impressions of DFO Chum scales. CNN models were developed using 15,754 scale images; 24% of he o al collec ion. Da a were spli in o raining (70%, n=11,012), valida ion (15%, n=2,365), and es ing (15%, n=2,377) and randomly bu s ra ified by age classes o ensure consis en age class dis ribu ions across each se . We deployed an ensemble of hree CNN models archi ec ures wi h a proven rack record in heir applica ion for image classifica ion and regression problems. The ensemble model of Efficien Ne V2L, NASNe Large, and ConvNeX Large provided excellen age predic ions for he mos common age classes of Chum recrui ing o he fishery (Figure 1) (Ames, e al., In press).

In he case of groundfish, he o oli h is he s ruc ure employed and i s weigh , shape morphome rics and Infrared spec ral scan are he a ribu es. Toge her, he o oli h morphome ric a ribu es (weigh , dimensional measuremen s, and shape ou lines) and FT-NIR spec roscopic da a (Benson e al. 2023) were used in machine learning algori hms in R o crea e predic ive s a is ical models for species classifica ion, s ock delinea ion, and he au oma ed age es ima ion of selec rockfish species. Specifically, age es ima ion models of Rougheye, Yelloweye and Pacific Ocean perch provided es ima es ha me he lower accep able precision ra es se by quali y con rol parame ers for human genera ed precisions (Figure 2). Previously aged samples from he SCL S ruc ure Library will be sourced, a ribu e da a will be collec ed and incorpora ed in o curren models o increased he robus ness of age predic ions of hese rockfish species. 

The Al erna ive Age Es ima ion program has made grea advancemen s in predic ive age modeling based on key a ribu es of o oli hs and scales wi h plans o apply hese models o he mos commonly aged species a he SCL.","Tradi ional age es ima ion me hods rely on highly specialized skills developed hrough long- erm men orship, hese me hods are ime-in ensive and resource-heavy, limi ing scalabili y and hroughpu . The s eadily increasing demand for age da a regularly exceeds program capaci y forcing reques s o be aged on a priori ized basis. While a significan amoun of exper ise is required o produce fish age es ima es his is some hing AI can be rained o do. This moderniza ion and he work o da e es ablishes he groundwork for an AI-driven pipeline ha augmen s radi ional age es ima ion echniques, drama ically increasing efficiency while main aining scien ific rigor. Accura e and precise age es ima ion is pivo al for sus ainable fisheries managemen , conserva ion s ra egies and ecological research.

Increased capaci y benefi s age-s ruc ured s ock assessmen s ha facili a e judicious fisheries resource managemen decisions commonly via science advice genera ed in CSAS processes which depend on high quali y and consis en age-da a. Commercial Fisheries programs are managed in par nership wi h s akeholders relying on scien ific assessmen s and are dependen on consul a ive processes o develop and review policies, procedures and regula ion.

The implemen a ion of AI pipelines are designed o augmen age ou pu and no mean o replace age readers. SCL ins i u ional ageing knowledge acquired over 40 years of ageing experience mus be main ained o ensure predic ive age assignmen s remain precise and do no drif as a resul of environmen al pressures such as clima e change.","Model raining, es ing and valida ion will con inue wi h previously aged samples in order o increase samples robus ness of he hree aforemen ioned rockfish species and Chum. New species (Chinook, Quillback Redbandded and Widow rockfish) are curren ly in he process of scale imaging, and o oli h weighing, imaging and IR scanning. The overall goal is o crea e a image, weigh and IR libraries of all species aged wi hin he SCL age ca alog. Model raining, es ing and valida ion will proceed on all species when enough s ruc ure a ribu es have been a ained. This is he me ada a founda ion ha will suppor age predic ive AI age modeling.

Clima e change, in he form of increasing wa er empera ures will diversely affec salmonid species causing varia ions in he physiological rai s of grow h and me abolic condi ion. Consequen ially, driving a divergence from his orical grow h pa erns causing in erpre a ional difficul ies ha can resul in he “smearing” of age classes. The crea ion of image based libraries has a wo fold advan age; (1) i allows for au oma ed predic ive age assignmen s, and (2) i provides he abili y o moni or changing grow h ra es by he direc measure of scale annuli. Measures of grow h can provide informa ion encompassing ex ernal environmen al condi ions as indica ors of habi a quali y, and in ernal physiological s a us of heal h, s ress and reproduc ive s a e. The developmen of au oma ed measures of annular grow h are curren ly under inves iga ion. As clima e change becomes more prevalen he SCL expec s ha age reques s will increase o compensa e for he dynamic shif s in he ecosys em.

Curren plans for opera ionaliza ion of real- ime age predic ion of Chum salmon are underway. This will rely on a Frame Work lap op ha is specifically design o run he Chum age predic ive models and he SCL’s high speed au oma ed scale imaging camera. The series of even s are as such; 

scale images will be au o cap ured from he high speed camera,

an R-scrip will crea e image file names of species and specimen ID,

all o her a ribu e me ada a such as measure of scale grow h will be ex rac ed,

scale age will be predic ed, recorded, and expor ed o he Mark and Recovery da abase."
"PSSI Science Project Reporting chum gsi sogfra_final.docx","2436","Chum whole genome sequencing for improved s ock delinea ion",,,"PBS, Nanaimo, BC",,,,,"Fraser, Howe and Georgia S rai – Sou hern Fjords","Code will be published on Gi Hub/Zenodo along wi h he peer-reviewed publica ions.","The issue samples used in his work were s ored in he GSI lab archive.","The Gene ic S ock Iden ifica ion (GSI) of chum in sou hern BC, especially in he Fraser River and he S rai of Georgia (“SOG” hereaf er), has poor resolu ion.

We iden ified informa ive gene ic markers (single nucleo ide polymorphisms, SNPs) o improve he curren SNP panel for GSI (“GSI panel” hereaf er) and increase gene ic resolu ion in he Fraser and SOG. In par icular, we were able o differen ia e 1) chum re urning o he Chilliwack River versus he res of he Fraser and 2) chum from spawning loca ion in he SOG wes versus SOG eas . 

These improvemen s will improve s ock assessmen in hose wo areas.","GSI is rou inely used in he Nor heas Pacific o inform he managemen of Pacific salmon species, especially chinook (Oncorhynchus shawy scha), sockeye (Oncorhynchus nerka), coho (Oncorhynchus kisu ch), and chum (Oncorhynchus ke a). Of hese four species, chum is he mos widely dis ribu ed in he Pacific Ocean, and displays he weakes popula ion s ruc ure across i s range. Chum is managed join ly by Canada and he Uni ed S a es under he Pacific Salmon Trea y o ensure ha he fishery is sus ainable on he long erm, and GSI has become a pillar of effec ive s ock assessmen and managemen . Bila eral effor s be ween Canada and he USA have led o he developmen of GSI panels in each of he wo coun ries, wi h bila eral collabora ion ensuring a large overlap of SNPs be ween he panels developed in he wo coun ries o fos er exchange of da a and resul s. The Canada chum GSI panel consis s of 535 SNPs originally sourced from a series of RAD-seq (a genomic me hod o geno ype housands of genome-wide SNPs) s udies arge ing differen par s of he range, bu limi ed o Washing on and Alaska ( o be refined Small e al PSC repor , Mckinney e al. 2020; Mckinney e al. 2022), and subsequen ly op imized independen ly from he USA coun erpar . The Canadian baseline, he gene ic da abase used as reference o assign samples of unknown origin o heir s ock of provenance, includes geno ypic da a for over 32,000 individuals from 384 collec ions across he species range (Oc ober 2025). 

Despi e he geno yping effor s, some areas in sou hern BC remain poorly resolved, wi h wo areas being of par icular in eres : he lower Fraser and SOG. In he Fraser, he Albion es fishery, which provides crucial informa ion on chum re urns for s ock assessmen , relies on accura e separa ion of Chilliwack River re urns from he res of he Fraser, bu i is curren ly challenging. To avoid misassignmen and increase accuracy, albei a he cos of resolu ion, all collec ions from he Fraser are lumped in o a single repor ing uni . In he S rai of Georgia, wo main repor ing uni s are curren ly recognized: Howe-Burrard, including collec ions from Howe Sound and Burrard Inle ; and S rai of Georgia, including collec ions from he wes and eas side of he s rai ha are no included in he Howe-Burrard repor ing uni . Even hough assignmen accuracy be ween hese wo repor ing uni s is low wi h he curren SNP panel, he analysis of he baseline samples sugges ha addi ional effor s may help discrimina e collec ions from he eas and he wes side of he S rai , hus increasing overall resolu ion in he SOG.","We used whole genome sequencing o fully charac erize genome-wide sequence varia ion wi hin he Fraser, SOG and adjacen areas, including Puge Sound, Johns one S rai , and Wes Coas Vancouver Island. We sequenced 15 individuals from each of 45 collec ions in hese areas (Fig.1), and called varian s using s ringen quali y fil ers. We iden ified more han 11 million SNPs (excluding rare varian s) across 594 individuals, which is 21,000X he number of SNPs included in he curren GSI panel (535 SNPs). We performed Principal Componen Analyses (PCAs) o inves iga e popula ion s ruc ure. Analyses based on 100,000 randomly selec ed SNPs, a subsample of he full ca alogue of genomic varia ion, showed grea resolu ion improvemen compared o he reference baseline including da a from he 535 SNPs of he GSI panel (Fig.2): he Fraser, SOG and Puge Sound were markedly differen ia ed from each o her, he Nor h Puge collec ions were clearly separa ed from he res of he individuals, and we s ar ed o observe differen ia ion be ween Chilliwack and Fraser, and SOG eas and wes . More focused analyses including only Fraser-Chilliwack or SOG samples revealed significan differen ia ion wi hin hose wo areas. To iden ify a se of highly informa ive SNPs o add o he GSI panel, we calcula ed FST, a measure of gene ic differen ia ion, across all SNPs wi hin each of he wo areas and selec ed he 100 SNPs showing he highes differen ia ion in each area (Fraser and SOG). 

We ex rac ed he geno ype da a from he whole genome sequencing da ase for he SNPs in he GSI panel and he 200 highly differen ia ed SNPs in he Fraser and he SOG. 121 of he 535 SNPs in he GSI panel were no presen in he whole genome da ase because hey were ei her excluded due o quali y and/or low minor allele frequency fil ers, or because hey were no variable in he arge geographic area. Using Leave-One-Ou (LOO) analyses we es ed for changes in GSI accuracy be ween he curren GSI panel (414 SNPs) and he improved panel ha includes he GSI panel and he 200 differen ia ed SNPs (614 SNPs). The addi ion of he 200 SNPs resul ed in much improved assignmen s (Fig.3 and 4). When we es ed he curren GSI panel, assignmen s o he SOG had low rue posi ive ra es, indica ing low assignmen probabili ies or misassignmen s, and individuals from each side of he s rai showed similar probabili ies o be assigned o SOG eas or wes (Fig.3). In he Fraser, Chilliwack individuals ended o be assigned o he res of he Fraser, resul ing in high false posi ive ra e when he Fraser was he arge repor ing uni , and low rue posi ive ra es when he Chilliwack was he arge repor ing uni (Fig.3). In con ras , when we used he improved panel, all analyses showed low false discovery ra e (FDR < 0.05) and high rue discovery ra e, hi ing he arge accuracy hreshold of 80% of individuals assigned wi h 80% probabili y assignmen , excep for Chilliwack, which showed grea improvemen bu fell sligh ly shor on he rue posi ive ra e (70-75% ins ead of > 80%, Fig.4) . True posi ive ra e of assignmen ","A good unders anding of popula ion s ruc ure is crucial for he effec ive managemen of Pacific salmon, including chum. The la es s udy inves iga ing popula ion s ruc ure in BC and Washing on is almos 20 years old, and was based on only 89 SNPs, gran ing ra her limi ed resolu ion, especially in he Fraser and SOG (Small e al. . Addi ionally, he genomic da a used o develop he curren GSI panel were collec ed from American spawning loca ions only, and he genomic varia ion ha is unique o Canadian s ocks was no cap ured. Wi h our work on chum funded by PSSI we have charac erized popula ion s ruc ure in sou hern BC and Puge Sound and iden ified SNPs ha are highly differen ia ed and informa ive of popula ion differen ia ion in he areas of in eres . An improved GSI panel based on our resul s will grea ly improve GSI resolu ion and accuracy in he Fraser and SOG, and beyond. 

We have been con ac ed mul iple imes in recen imes for informa ion on popula ion s ruc ure in chum, bo h in ernally wi hin DFO and by American agencies, o be er inform s ock assessmen and managemen and ha chery prac ice. For example, apparen lack of popula ion s ruc ure in he Fraser has led o he movemen of chum of differen origins among ha cheries. Our resul s provide evidence of popula ion differen ia ion wi hin he Fraser, which should be kep in o accoun in ha chery prac ice o ensure he preserva ion of unique gene ic diversi y and po en ially local adap a ions o differen par s of he Fraser wa ershed. 

Our NE Pacific range whole genome sequencing da ase will provide addi ional informa ion on popula ion s ruc ure across he chum Nor h American range and a sui e of ad hoc genomic analyses, including assessmen of gene ic diversi y, demographic recons ruc ions, measures of genomic vulnerabili y o clima e change, will provide informa ion o priori ize conserva ion effor s and ensure long- erm sus ainabili y of fisheries.","In he coming mon hs, we will perform addi ional assignmen es s using individuals ha were no originally included in he SNP discovery and GSI panel improvemen analyses, and even ually add he informa ive SNPs iden ified o he curren chum GSI panel. 

Dissemina ion of resul s a he Pacific Salmon Ini ia ive Symposium has spurred in eres in o fur her charac erizing fine popula ion s ruc ure of chum in he Fraser and preliminary resul s are encouraging in his regard. We are also working on charac erizing genomic areas of differen ia ion ha could be associa ed wi h rai s of in eres , such as iming of migra ion. Finally, we’ll expand our inves iga ions o he res of he BC range and beyond as described above.

The resul s of our s udy will resul in an improved GSI panel ha will help differen ia e chum from differen areas in sou hern BC a an unpreceden ed resolu ion, hus informing and improving ha chery prac ices and s ock assessmen ."
